,replies,tweet
0,"[' ゴミが溜まって沢山のゴミになった。', ' 人が増えた\n\n・・・\nそれだけ！', ' HP(支持率)が下がりました https://t.co/lndKhF0GcH', ' こいつら、変えるつもりねーからな( *｀ω´)', ' ゾンビかミイラってことでしょうか', ' 党名を変えなかった事は意外でしたけどね\n分裂して党名変えたら中身は民主党でも支持率上がったのだから\n\nなら、選挙対策でくっ付いただけなのだから\n党名変更して党首も変えた方がマシだと思うのだが\n\n次… https://t.co/aC3VTJpBQ2', ' ただの、元鞘って感じですね。', ' 目新しさが全くないですな。\n興味もわかない。\n意味あったかな？', ' 左翼集団としては、より純度は増した。', ' 民主党の時よりスケールダウンし劣化が進みました。', ' 何も変わりません。\nゴミ＋ゴミ＝大量ゴミです。\nゴミが増えただけ。\U0001f923😂\U0001f923😂', ' 選挙互助会です。選挙が終われば、また、分裂します。ここまで茶番劇を見せられると、期待どころか笑うしかない。', ' @mTNbNcFO99msnsp ゴミとクズが合体してゴミクズになった。', ' よりゴミ感が増した。', ' かごの中のハムスターと一緒ですね！同じところを走ってる。（笑）', ' 相変わらずですね。国会は、妄想モリカケの追及が続き、貴重な時間と国民の税金がが空費されるでしょう。何とかしたいけどね。', ' ずっこけました', ' @rinnokuni 何一つ変わりません。これまでも、これからも❗\U0001f971', ' @mat326 とんだ茶番ですよね。笑', ' 民主党に戻っただけw', ' 少し人数が増えた。\n民意は無視する姿勢がより明確になった。\nそんなところでしょうか。', ' 党名が変わるたびに劣化しているだけです。', ' 希望も棄て、国民も棄てた非 国民民主党議員が加わりましたので、自由もなく、希望も棄て国民も棄てた党が名実共に出来上がったんじゃないでしょうか？', ' ゴミ集団が分別されたけど行き先は一緒だった、夢の島', ' 世間の目は変わりましたよ', ' 党首も党名も一緒。これで「新しい党だ」と言われてもねえ…。', ' 先祖返りってやつですね', ' 何も変わってはいません。新党名は #元の木阿弥民主党 が最適だった。😪', ' このまんま💢\U0001f923\n売国奴、政党です❗ https://t.co/Ou4mkflLta', ' ゴミの純度が高くなりました。', ' では自民党も何か変えるって事で、議員さん全員Twitterアカウント作って欲しいなぁ。特に国民影響の大きい環境大臣は今すぐ作って欲しいです^_^', ' 今まで通りの立憲ですね、まだ党首が泉さんなら変わるチャンス有ったかもですが、これでは無理かと(ヾﾉ・∀・｀)', ' 散った議員が再集合しただけ。\n野合の衆。', ' 数年前に戻っただけだろ（笑）', ' @toshi3561 老朽化してボロボロになっただけ。', ' 「あたらしい」が古臭い。立憲民主党。\n\nちなみに「立憲民主くん」は胸を撫で下ろした感じですね。\n\n先日、その親元からは「我が党とは無関係」とばっさり切られてたけど。', ' むしろ原口や柚木が加わって最凶になった', ' なんも変わらんでしょ\nこんな思想や政策の違う集団が選挙のためだけに集まってまた意見が合わなくなると新党作るんでしょ\nほんと信用出来ないわ', ' これで新党とかいうのやめてほしい。国民から抜いただけやん💢😠💢', ' 悪夢の立憲民主党が、さらに凶悪になっただけ。', ' 濃縮された💩', ' 多分、支持率変わるんじゃないですか？悪いほうに', ' そりゃあ、旧国民民主から来たよそ者を支配する権力が増しましたよww', ' 立憲民主党に億単位のお金を持参して数十人の議員が増えた🙄？', ' ロゴを変えるのが、めんどくさかったんでしょうね(笑)', ' 昔の名前で出ています', ' 何時も同じ事を繰り返しているだけ‼️また離れますよ‼️', ' ゴミの量が増えた', ' ゴミの量(-。-)y-゜゜゜', ' 預金残高。', ' 害虫が増えただけですよ😢🐭', ' これで刷新したんですよ彼らの頭の中ではね\U0001f923😁', ' 人数が増えました\U0001f923', ' ◯◯が少し増えました😩😩', ' ゴミがゴミになったw', ' ただの吸収合併でしたね笑', ' 代表変わらす\n党名変わらず。\n\n立憲民主に吸収されただけ。\nコレが何を意味するか、\n元から立憲にいた議員と外から来た議員の軋轢😁😁😁\nイジメ。\n選挙の比例順位とか。。\nまたすぐ分裂するに一票', ' @oznokakashi ああ、お菓子のパッケージに「美味しさアップ！」って書いているようなものです。\n言うだけならタダですからw', ' @moea0708 髪の毛をカットしたとか？', ' 変わる要素とか1mgも配合されてないですね。\nどちらかといえば変わる可能性がありそうなのは国民民主のほうかと。', ' 国民の声を聞かず、非公式の投票結果を無視し、独裁野党が又出来ただけ。何も変わらず。', ' せめて党名は変えて欲しかった。「一緒に民主党」とかね。', ' 立憲やマスコミの言う「民意」は無視(笑)', ' 毒の濃度が少し上がった。', ' あやさん、お疲れ様です。\n目指すは「政権交代」だけであり「国家・国民のために働く」と言う考えは一切持ち合わせていません。以前の立憲民主党と何ら変わってないですね。', ' 何も変わらない。烏合の衆ですから。野党として週刊誌ネタは、止めてもらいたい。', ' ダメだこりゃ！喫煙のルールも守らん口先だけの男が党首とか悲しいな〜', ' 気分ですかね？', ' 帰ってきた民主党のような立憲民主党ってだけですね。', ' 中身は民主党', ' （嫌な方向へ）濃縮されましたｗ', ' 本部の部屋数と椅子、机の数が増えました。今後ゴミの数が増えます。おめでとう㊗️ございます。政治不審の数が増えない事を祈るばかりです。合掌', ' @hisakzdakao 昔に戻っただけ、帰ってきた民主党！ウルトラマンは正義の味方だが、民主党は韓国の味方😅\n民主党じゃ選挙に勝てないからって名前変えて分裂したのに忘れちゃたのか？ https://t.co/1ZA7NRDiIY', ' 何も代えない、何も変わらないです。。', ' なにも変わらず(ﾟωﾟ) \n\n渡り鳥は離れたり、戻っただけ〜', ' ゴミ箱の中のゴミが増えた感じですね。', ' 分裂→新党立ち上げ→再結集\n\nこれだけ信念の無い政党も珍しい', ' 合流とは名ばかりで、元国民民主党の所属議員が立憲民主党に吸収されたことが明確になりました。', ' 何も変わっていません\U0001f923\U0001f923\U0001f923\nただのパフォーマンス野党軍団です‼️', ' ゴミが増えただけ・・・', ' なにも変わらないですよw', ' より左に偏りました（笑)', ' 頭数だけですね、変わったのは。', ' 小沢一郎が入ったくらい？(元に戻ってるwww )', ' 出来レースもいいとこ', ' 何も変わってませんね。', ' 何も変わっちゃいないです。\nあえて言うならば、衆院選挙比例区で落選確実議員が増えただけです。', ' 壮大な茶番劇。 https://t.co/vSnuyzOD7q', ' 何も変わってないですね。\nこれでは、国民が合流しただけですね…😅', ' 見た目や中身同じw\nあのマトリョーシカの様にどんどん小さくならなけりゃ良いですけどw', ' 変わりなしです。。。人が増えたらだけです。。。', ' え、益々恥を晒せるところ']",何が変わったのだろう？😂 https://t.co/0jpJ25KTvE
1,"[' @kishida230 都心と地方では生活水準も違うから一概に東京と鳥取を数字だけで比較するのはどうでしょうか？産む環境が違えば費用も変わる。それよりもなぜ高くしなければならないのか？っていう根本… https://t.co/OkWgEFY7Ar', ' @kishida230 どなたにお作りいただいたものか、素晴らしい表ですね。', ' @kishida230 都知事レベルで解決できると思うが？', ' @kishida230 それ以前に産婦人科医がいない市町村がある。そちらの方が問題だろ。', ' @kishida230 岸田先生の案自体に反対はしませんが、そもそも少子化の理由は目先の所得減に加え、将来的な所得の伸びを想定できないからでしょう。\nこの諸悪の根源こそが緊縮財政によるデフレなので… https://t.co/KT6Lk5MtJO']","東京都内での出産と地方での出産で、総額費用が全然違います😢
H28年の調査ですが、平均価格が最も高い東京と、平均価格が最も安い鳥取では、20万以上も差が‼️
これに加え個室を選択したり、やむを得なく長期入院したりするとさらに＋αで… https://t.co/Pl6BjSGsS2"
2,"[' 都合のいいときだけ女という性別出すから総理になれないんだ。実力と仲間を作れなかったと言えば、少しは協力しようと思うのが人情。', ' 野田さん、このインタビューでも、すいぶんとズレたことを言ってますね。\n総理候補になれないのは、女だからじゃなく能力がないから。人望がないから。', ' 高市早苗代議士(夫婦別姓反対)と、同じ年齢当選も同期です。賛成は野田代議士。', ' なんで議員出来るのか不思議。立候補時点で身体検査した方が合理的だとおもいますがいかがでしょうか。', ' 私も64才になった。未だに肉体的にダメージ無い。大事なのは、仕事が、好きだからできるのでは、ないか。\n女性が、能力いかんで総理になれないは、自分の限界を決めている。大事なのは、全てにおいて努力が、… https://t.co/pQ8wuDyhB4', ' エイジハラスメントですｗ', ' 女性だから総裁候補になれないって理屈こそ差別意識（特権意識）を持っている証明ですね。\n野田氏が総裁候補になれないのは女性だからではない、能力も人望も足りないからだ。']","野田議員が60歳にいつの間にかなっていたことに一番驚いたわ...もっと若いイメージあったのになあ。私もその分年齢を重ねたということか...。

野田聖子元総務相「私が総裁候補になれない理由」を赤裸々告白　 https://t.co/rm4fHP7n37"
3,"[' 不妊てほんと多いんですね。おれは2/2の確率で\nつまり100%の確率で2人の子供がいるのに😅', ' 一生懸命に不妊治療を頑張っていらっしゃる女性なら、必ず子供を大事にする良いお母さんになってくれると思います。\nそういった方に保険が使われるなら健保を払う甲斐がありますね。', ' スマホ料金を更に下げて欲しい。この問題にも菅さんは、斬り込んでくれた。現実問題に斬り込んでいるなあ。', ' これは大賛成ですね！\n子供の貧困云々よりこれも優先して頂きたいと思います。', ' それだけ不妊治療にかかる費用がバカにならないのですね', ' 今や結婚式のスピーチで「元気な子供を沢山産んで下さい」などという言葉はアウトだそうですね。\nそれの何が悪いんでしょうかね？\n子供を沢山産むのは最も大切な事だと思うのですが‥', ' 良い提案ですね！\n好きな人の子供を授かれるのは、喜ばしい事だと思います。\n\n不妊は男女ありますから、それに似合った保険適用になることを願ってます。', ' 今までは保育園や託児所を増やすような政策ばかりでしたが、もっと根本的なところで困っている人たちは沢山いますからね。少子化傾向に歯止めをかけるために、是非、こうした政策を実行して行ってほしいですね。']","不妊治療している友人も周りに結構いるので、これは凄く助かる政策‼️
菅さんが総理になったら早急に実現していただきたいなぁ。 https://t.co/Atdv69iefv"
4,"[' 来年のオリンピックまでモチベーション持たないかも？\n本当は？やるのやらないの。国民には、大問題‼️\n早期解決をお願い。', ' ツールドフランスが開催されていることが大きいかと\n日本では自転車のレースは評価低いかもしれませんがツールドフランスはヨーロッパではオリンピック並みの扱いですから', ' 開催決定＼(^o^)／\n緑の豚が知事で居るのが癪だ。\n安倍総理が総理でいらっしゃらない事が、残念だ。', ' これは…\n東京にとっていいことなのだろうか？\nと、真面目に考えています', ' 腐れています。明日でもコロナ中国ウイルスの活動は存じておりません。更に来年の７月は完全情報は皆無です。日本が最悪の国になるか？それとも最高の国かにライン上にいます。感染拡大すれば医療関係が完全に破壊します。', ' 小池にゼロリスクはダメ～といってください。\nオリンピックも潰しかねないです。', ' IOCも懐苦しいですからね～🙄🙄🙄', ' 当然です。']",え、本当に？😵 https://t.co/ZSSfwdZ0Ea
