,replies,tweet
0,"[' 菅直人どうすんの？\n洒落になってないよ。', ' 泉だな', ' 暑い中お疲れ様でした🍵', ' カジノは嫌だなぁ…', ' 何でも良いけど、自党のクソみたいな行いの議員にちゃんと対応しろよ。\nシバキ隊の石垣のり子\nチュサッパの有田芳生\n関西生コンの辻元清美\n事情聴取して処分出来ないのは、何か後ろ暗い事情があるんだろうなあ。\n頑張れ枝野、特亜の為に❗️', ' この問題にはどう取り組んでいますか\nhttps://t.co/ETuogPhM2M', ' 大変ご多忙なスケジュールの中、ご視察いただき、本当にありがとうございました。横浜市民の皆さん、県連カジノ対策本部の地方議員の皆さんと力を合わせ活動してまいります。引き続きのご指導、どうぞよろしくお願い申し上げます\U0001f932！', ' きょうやるべきことなのでしょうか？', ' #しのはら豪 さんが、#野党統一 候補になられる事とご当選される事を祈りますﾟ+(人・∀・*)+｡♪\n\n#立憲民主党\nがんばれ立憲民主党\n#がんばれ野党', ' もう二度と神奈川県に来ないでくださいね']","神奈川の仲間の皆さんに受け入れ手配をいただき、同行してもらいました。
ありがとうございました。 https://t.co/Jj6ZNQj0gO"
1,"[' 枝野さんには、菅さんが仕掛けた広島代理戦争の広島行って欲しいな。菅新政権誕生したら河井夫妻の選挙買収事件を徹底的に追及して欲しい。', ' 横浜港ハーバーリゾート協会って、IR反対派の協会じゃありませんでしたっけ？\n\n地元ではIR誘致による治安悪化やギャンブル依存等を懸念する声はもちろんありますが、「歓迎していない」というのは地元民総意… https://t.co/AJ5Ah2K46w', ' 賛成派の意見は聞いたのかな', ' @fuku_tetsu 神奈川県民ですが、誰が歓迎していないんですって❓\n邪魔しないでください、お願いだから。', ' あなた方は大半の日本人に歓迎されていない事を自覚して下さい。', ' 地元地元って言うけど\u3000左の団体ならダメだぞ\u3000片方の意見ではダメ\u3000両方から聞け', ' @renho_sha パチンコ利権確保のためだろ？', ' パチンコ廃止もお願いします💦💦', ' @renho_sha 手を挙げたのは横浜市。\n地方自治への干渉ですね。', ' 何故急に今視察なんですか？菅長官が総理になった時の足を引っ張るためのネタ探しにしかみえません。相変わらず政権監視という名のネガティブキャンペーンをまた繰り返すつもりでしょうか？懲りない方ですね。', ' なんで公表しないの？選挙したらネットでも公表しなきゃｗ\n\n自助の為ですか？ https://t.co/pcfDGNG9QK', ' @fuku_tetsu お散歩か？', ' @fuku_tetsu 生コン連帯ツジモトとJR総連エダノが一緒に横浜に居る⁉️\n止めてくれー地元が汚れる…\n早く帰ってくれ〜耐えられない‼️', ' カジノよりパチンコどうにかしてください。', ' 友達がパチンコで借金して離婚しました😢\nパチンコも潰してください‼️', ' だったら全国のパチンコ店潰しましょう！！', ' @renho_sha 歓迎していない地元は一部の人達。\n多くの人はまだ無関心です。活動しているのは署名活動に熱心な立民、共産、ネットワーク系。\nそれを地元とのすり替えは、ごく一部支持者を「国民」「市… https://t.co/0T0Qjq00fr', ' @renho_sha 賭博は家庭を壊し、人生を狂わせる。犯罪も増えると、もっと大きな声を上げて都民、県民に訴えろ！', ' イチャモン大串に、生コン辻本、、、\n\nほんとろくでもないモノばかりやわぁ', ' @renho_sha あなた達は何をしたいのか見えてこない。また、沖縄に基地は要らないって言って票を稼ぐのかな？', ' @renho_sha 反対派の意見しか聞かないんですか。\nそれで全てを分かった気になるんですか。\nそうですか。', ' 仮にＩＲがスタートしてから今回のコロナが発生していたらどうなっていたか？\n果たしてＩＲは有効な政策なのか？\nそのあたりの検証をしてみて下さい。', ' 菅官房長官の自助を批判し､やる事なす事貶すだけ｡あなたは政治家ではなく､ただのクレ―マ―', ' @renho_sha 辺野古のテント村のプロ市民の意見を地元の民意とか言ってるあなた方らしいね。', ' 地方の事は地方に任せとけ。', ' 日本人から税金取るのと、外人がカジノで金おとすのと、どっちが国民の為になると思ってるんだろね。\n\n立憲は、日本人の敵と変わらん。', ' @renho_sha 成功は批判の先にある\n時には批判を振り切って政治をする勇気も必要だと思います 国民は注意深く見てはいますが 圧倒的政治力と決断力ある政治家を求めています 国民は保守を求めるもの… https://t.co/gAZtgxXtEz', ' @renho_sha 生コンの人、まだやってるのか。', ' @renho_sha IRではなく、湾岸事業者や地元主体で観光集客施設を開発する構想をしている「横浜港ハーバーリゾート協会」はIRでなくそれをすることでメリットがある方々ですよね？それを「地元」と表現するのはよろしくないかと。', ' 枝野さん反対するのはいいよ、誘致した場合の、雇用、集客力、税収もしっかり数字出してから反対してよ。', ' 横浜だけやめさせればええやろ、もう法案は通ったのに仕事してる感出すなよ', ' 1菅直人の船長釈放問題について説明を求めます\n2石川議員の新宿の件は真実かどうか説明を求めます\n3石垣のりこと自身のたばこ問題など、他人に厳しく自分に甘いスタイルに不満があります\n\nまじめに政治をやらないならリベラルを名のならないでください。', ' 歓迎していない人しか集めてないとか？', ' 何を今更働いてるフリしてんの❓\nあざといなぁ…最近まで地域視察なんてしてないじゃん！アホ草。', ' 財源はタバコ増税で！！', ' NHKBSで放映してましたが、米国の暗黒街は、禁酒法とカジノから始まったようです。横浜で暗黒街まではいかないまでも、反社会的勢力が暗躍する環境を提供するようなものです。目先のことだけでなく、日本の将… https://t.co/LtInNqUVMm', ' ひとつの団体のみの話を聞いただけで決められちゃうんですね…誘致推進派の話は聞かないんですね', ' 予定地\u3000\n\n濱の中ではなんかパットしない場所なんだよな、物足りない感じ‥\u3000\n\u3000港湾関係トラック\n\u3000ばかりで‥\u3000\n\n伊勢佐木町や関内のど真ん中に造るなら文句の１つぐらいあるが、\n\n場所が場所だけに観光にも役立つし\n\u3000有効活用できるならいいと思う。', ' 引き続き\n・議員報酬を平均賃金と同額に\n・政党助成金廃止\n・献金禁止\nを政策として下さいますようお願い致します。\n\nこれくらいやらないと投票率は上がりませんし、\n貧困や格差が言われる国で政治家が富裕… https://t.co/mTMSKOyBQG', ' 地元の賛成の人の話も聞いてあげてくださいね！', 'らなければならないのか。政治は、地に足をつけて草の根や市民の声をしっかりと受け止めなければなりません。地元の歓迎していないことをトップダウンで進めていく政治と、草の根から暮らしの声に寄り添っていく政治… https://t.co/kZY95krzZ4', ' 視察中も、喫煙は指定の場所でお願い致します!', ' 横浜港ハーバーリゾート協会か反対しているだけで、地元の反対と決めつけて、良いのですかね〜？', ' ＞港湾事業者や地元主体で観光集客施設を開発する構想をしている「横浜港ハーバーリゾート協会」の皆さん\n\nIR誘致反対の立場の人達から話しを聞けばそうなりますよね？\n何やってんの？（笑）', ' ありあけのハーバー🎶\n横濱ハーバー食べましたか？']",本日、IR誘致候補地の横浜山下ふ頭を視察しました。IRではなく、港湾事業者や地元主体で観光集客施設を開発する構想をしている「横浜港ハーバーリゾート協会」の皆さんからお話をお伺いしました。百聞は一見にしかず。地元も歓迎していない中、… https://t.co/DD5ZQDhiyt
