,tweet,replies
0,迷惑をかけないことを重視する社会は息苦しい。多様性を認めるのは大事だけど、違う人をすべて理解するのは難しい。「相手のことをわからないなりに受け止め、対応するという力」が必要だ、と。　→潰瘍性大腸炎で気づいた「あいまいさへの耐性」が… https://t.co/ZEo8xAGVq2,"[' 人間は思い込みや偏見があるものと思います。そんな性質の中で相手を理解する姿勢や差別的な対応にならないよう、自分を律して学びながら相手を受け入れていきたいものです。', ' 早く、押し紙やめてください。', ' なんか\u3000朝日が言うと欺瞞に聞こえる｡\n認め介入しないことが一番', ' そもそも多様性、多様性と叫んでいるサヨクは英語をちゃんと喋れるのか？\n外国で、外国人のなかで、外国人の文化につかって生活し、その違いをちゃんと知っているのか？\nそんな経験もしたこともないいつものサヨクの、絵空… https://t.co/z3RFg1EcTa', ' まあ、逆に「迷惑をかけることを重視する社会」でも困ってしまいますけどね。']"
1,ゆれ～,"[' 宮城県みたい\nけっこう長い時間揺れていましたよ💦', ' ツイッターなら最速の地震情報をフローすることが可能だとはいえ、報道に携わる人間として「ゆれ～」ってどうなの？\nいつも、報道に係わる重要な問題はスルーする理由が理解出来ません。', ' 茨城県沖の後に宮城県沖で地震が発生してますね\n念の為に非常用持ち出し袋の確認はしておいてください', ' だいじょぶか？にゃ', ' ｶﾞｸｶﾞｸ(((( ；ﾟДﾟ))))ﾌﾞﾙﾌﾞﾙ']"
2,自国の黒人デザイナーを排斥した業界が、BLM運動を支持。歴史の負の遺産に向き合ってこなかったから、との指摘も。 https://t.co/wazhMQNXEV,"[' 当たり前だ。そもそもアパレル業界そのものが差別で成り立ってるんだから。', ' 日本も人のこと言えないよね。', ' チャイナは北イタリアのアパレル業界乗っ取り、チャイナ移民が工員。北イタリア自体、順調にチャイナの植民地化進行中。\nhttps://t.co/98AkBfWm6k\nによるとミラノの住民登録の姓のトップ10中三つ… https://t.co/xmu0H6KIBM', ' 根の深い話。自国の負の歴史に向き合ってこなかった、というのは日本にも言えますね。', ' BLMへの支持表明って\n\nヤバいやつに絡まれないようにする\nリスク回避の面もあるでしょう\n\n本音と建前\n\n黒人文化を理解せずに\n黒人文化から受けた影響・印象を表現したら\n今度は文化の盗用と叩かれる\n\n触らぬ神に祟り無し\n\nと思うのも不思議ではない', ' イタリアの負の歴史？\nアフリカからの大量の不法移民のことか？', ' 差別や偏見はどこの国にでも、誰にでも有ります。\n人間が偏見を完全に無くすことは不可能。\nだから常に、自分が差別をしていないかと自分自身を疑って帰り見る必要が有るのです。']"
3,(死ぬ権利、フランスで議論再燃　難病患者「極度の痛み」―「意思尊重を」声多く：時事ドットコム https://t.co/1PM70WhpfD,"[' 何度も使う内に傷みを和らげる薬が効かなくなる。\n大麻を認めたのも、薬として使えるから。習慣性も低く、副作用も少ない。モルヒネだって麻薬。何故、大麻だけ使用を認めないのかって問題。', ' 死ぬ権利の問題では有りません。\n自死止めることは不可能です。\n\n医師が殺人をすることが許されるのか、という問題です。']"
4,こうしたイベント以上に、早期の緩和が必要なのが、裁判所の傍聴席。今なお4分の1程度に減らされている。早く通常に戻すべき。　→演劇・映画館、満席容認　イベント開催制限緩和了承　分科会 https://t.co/Y7eGBeKGqi,"[' （その是非はともかく）\n裁判所の傍聴席で喋るとかはないはずなので、今回基準に従えばマスク着用なら満席OKはずで、裁判所も変わる可能性が‥\n（個人的にはそれでも50%が良いのでは‥とは思われていますが‥）\nどな… https://t.co/Lr1d0zBdxo', ' そりゃそうだ。傍聴席で喋る人間はいない。', ' 自己規制ですかね～？\n普通、しゃべらないと思いますので早く戻してもらいたいですね！', ' 自分は逆に緩和は必要ないと考えてます。演劇・映画館はリモート、オンラインで対処可能で実際オンラインで収益上げてる所もあります。傍聴も同様に移行する時期に入ってきているのかと。', ' 傍聴デートもできなくておれのちんこも膨張できない']"
