,tweet,replies
0,菅氏“消費税増税”発言の真意　高橋洋一氏「財務省が巻き返している…ただ衆院選で豹変も」 https://t.co/Cm04tNmg2h @zakdeskより,"[' @zakdesk 自民が政権担う限りは消費税は上がる一方でしょう？そんなのアホでもわかる。自民という利権集団は国民のことなんてこれっぽっちも考えてませんからねえ。', ' @zakdesk 菅氏も財務省のも財務省のお膝元。国会議員ばかりが美味しい思いばかりしていて、国民が苦労を強いられる。', ' @zakdesk 消費減税をせずに解散、総選挙をすれば桶狭間の戦いになる可能性がある。桶狭間の今川義元になる可能性。全野党が消費税減税、凍結（期限付）を公約に選挙になれば。日本共産党を含む全野党連… https://t.co/WOx6ANVkW0', ' @zakdesk 財務省って監視する組織が必要では…。', ' @zakdesk もっとリアルな話。財務省のロボット議員がいて票に直結しているからだと思う。', ' @zakdesk 世の中の時流に乗れない、国民の気持ちを理解できない政治家。能力的にほとんど差のない、国会議員の中で3センチ前に出てくれる人がいれば、希望も持てるのに', ' @zakdesk 消費税について，国民は財務省の大ウソを知っており，\n今こそ消費減税！という世論は高まりつつあります。\n総選挙の決め手は消費税減税と安全保障だと思っています。\n今後の日本国家の興亡を決定付けるかもしれません。', ' @zakdesk まっ、３人とも似たり寄ったり。\n\n政治家には一切期待しません。\n\nマクロ経済を深く理解していた安倍さんが\n２度も消費税を上げましたから。', 'しないほうがいい。結局選挙前が重要\n9/7経団連会長「財政再建」発言（Ｚの振り付け）\n9/9菅氏「三者討論会で経済主義」発言（Ｚへの反論）\n9/10菅氏「行革の上10％超への将来的引上げ」発言（Ｚの… https://t.co/jyhEDnPFRH', ' @SharkIjuin @zakdesk 「増税はやらなければならない」\n\n←完全に財務省の書いたシナリオですよね。菅さんの本心じゃない。「アベの後を継いだアンタが減税とか勝手なマネはさせない」と… https://t.co/iHhcfgFhXZ', ' @zakdesk 財務省増税レジームを脱却するための最大の方策は、人口減少下でも経済成長することを証明することである。\nその為には財務省に反して減税しなければならないという矛盾。\n我々が減税圧力で頑張るしかない。', ' @zakdesk 先日の高橋さんのご質問に三橋先生が答えを示してくれました。\nお礼を言いに行きましょう。 https://t.co/uhsyzFVOC5', ' @zakdesk パンダ省は強いから、増税するんだろうな。\nいずれ暴かれると思うが。']"
1,人事ではこういうウソあり、「2万％ない」と言った方もいた。でもそうなるかならないかは菅さん以外に原則わからない→「２００％ない」「いや、２万％」　菅・橋下氏、新内閣人事で掛け合い：時事ドットコム https://t.co/BeD9s0OXDs @jijicomより,"[' @jijicom 菅さんと橋下さんは、以前から緊密な関係です。第一次安倍内閣で安部総理が辞任した後、安部総理を橋下さんに引き合わせたのは菅さんです。', ' @jijicom 橋下氏は国政に参加して欲しくない', ' @jijicom 策に溺れる橋下は安倍首相を醜悪に持ち上げ出した。メディア神輿で難癖つけ捲ってたのついこの間。アベのマスク「もうやめろ」、ホームステイコーヒー「何やってんだ」。和田アキコそっくり。… https://t.co/psgkbOIuXv', ' @jijicom 女性宮家、皇統について不勉強な大臣を採用したいですか？\n冗談じゃない。\n先生も悠仁様を以前 可愛そうと三浦瑠璃さんの如き お言葉を発せられた。\n覚えておりますのです。\n直ぐに修正なされたが、腹の中はそれか？と疑っておりますよ。', ' @jijicom 本気で無しにしてほしい', ' @jijicom 200%でも20,000%でも、確率で言っているから、絶対的にないとは言っていない。気象庁の予報が外れた時の言い訳を大袈裟に言い換えただけ。', ' @jijicom 行政改革と言えば橋下徹！', ' @jijicom 200%ない→マイナス200%\n2万%ない→マイナス2万%\n\n掛けたら→200万%ある。\nドラゴンボールか。', ' @jijicom 仰るとうりですよね。スガさんがそこまでリスクを犯すかどうかです。', ' @jijicom 橋下氏を入れるのであれば「China優遇内閣」に認定します。\nあってはならない事だ。', ' @jijicom やって欲しいけど、逆風が強すぎる。', ' @jijicom 200%とか20000％とか\nそれどれくらいの確率か\nわかりやすく言って欲しい😩\n20000%よりは100倍あり得るの？', ' @jijicom どうも、菅と橋本は、同じような臭いがするからね・・？', ' @jijicom 橋下さんがテレビ活躍中選挙に出るのかと質問した人に０００％ないと答えたがしっかり選挙に出馬府知事に納まった。あの人は詭弁を操るようだ！', ' @jijicom 高橋先生は\u3000菅氏を大変評価されていらっしゃいますが橋下氏についてはどのような評価をされていらっしゃいますか？', ' @jijicom それでも橋下だけは関わらせるな。\nやるなら拉致問題担当だな。', ' @jijicom 橋下徹氏は大阪府知事も2万パーセント無い‼️と否定して出馬した男。だから信用しない。', ' @jijicom 維新は日本を破壊しそうなイメージなのですが、やつらはいったい何者でしょうか。\n\n橋下氏の皇室への考え方は、我々日本国民とはかなり違っていることも耳にします。', ' @jijicom 平熱パニックおじさんは勘弁。\nこれだけ嫌われてるのによく名前があがってくるもんだ。', ' @jijicom 何か、最悪内閣の予感がします(T_T)', ' @jijicom ハシモトチャン〜要請あったらやるんちゃうんかなぁ〜']"
2,毎日らしい笑。生活保護では被保護世帯数、被保護数、被保護率があるので、前後の文脈で適格な意味をチェックしないとhttps://t.co/D5BFSXjCd4→ファクトチェック：実は増えていた　「アベノミクスで生活保護世帯は減少」菅… https://t.co/GOFkOVKW1Q,"[' このように書く場合\n毎日らしい(笑)\nとカッコ付きの方がより良いと思われます。', ' 外国人も入ってますからね。', ' wai日新聞あるある\n#waiwai問題', ' この時期にこのような報道は\n犯罪ですね、酷すぎるデマ報道。', ' 毎日新聞 側だと生活保護の数じゃなくて保護者の質（困っている人）を問題にするべきだと思います\n\u3000\n救わないといけない人を きちんと救えているか ですね……', ' 東スポ１面よりはるかに信頼性の無い\n『ツチノコ新聞』\n🤣🤣🤣', ' 吉井理記という記者の記名入り記事ですね。\n日頃、生活保護には無関心なのに安倍憎さで付け刃で記事書いたからでしょう。\nファクトチェックの記事がノーチェックで出るというのは、記者個人のせいではなく、毎… https://t.co/WMVOA8QN2V', ' 民主党政権で一気に上昇しその後自民党政権で微減はしている、雇用者が増えても減少幅が少ないのはどうしてじゃろう、生活保護って本来は憲法上日本国民にしか資格は無いけど何故か人道上云々で日本国民以外も受… https://t.co/Aluy2LiM4a', ' 毎日新聞は、漬け物の包紙にしか役に立たないのです。', ' そうか、増えたなら減らさないと。取り急ぎ外国人の生保は問答無用で廃止で。', ' 嘘の記事？\nやっぱり新聞記事は信用できない。', ' 未だに安倍政権の粗探しを続ける変態新聞。\n遂に誤った統計の解釈で国民を欺く作戦ですか？\nこんな新聞読むとおバカになりますね。', ' 廃刊してください‼️(切実)', ' 有料限定てのはペットと化した既存の読者だけにしか通用せんとわかっとるんちゃうんか', ' 外国人の生保が増えてる話ですよね、掛け金なしで…', ' 高橋先生\n的確な指摘ありがとうございます。', ' もう新聞ってとっくに信者向け機関紙なんすね\n購読料はお布施', ' 民主党政権下の2009~2012年の増え方は急激、というファクト。 https://t.co/7AQcejcnW3', ' 毎日新聞やっぱりアホすぎる。\nファクトチェックと言いながら、その実態はファクトミッシング。\n公開アホ表明だろう。私なら恥ずかしくて３日くらい寝れないように思う。', ' この有料記事は読めないよな\n生活保護世帯は。\n\nまあ\n毎日新聞なんて\n\n平均以上稼いで\nアベノミクスの恩恵受けてる俺ですら金出そうと思わないが。', ' いつもながら卑怯ですよね。', ' ツチノコ新聞のファクトチェックをファクトチェック・イニシアティブにファクトチェックしてもらわないと。\nあ、意味ないか（笑）。', '。2015年3月をピークに減少に転じた。生活保護受給世帯数は約164万世帯。高齢者世帯が増加している一方、高齢者世帯以外の世帯は減少傾向が続いている。」\nこの資料… https://t.co/1cNKWYHFc2', ' 先生のグラフを見ると、民主党時代に生活保護数が上がり、安倍政権で下がってるとしか見えないのだが・・・\u3000こんな記事で、よくお金取るなと思う。', ' 万が一騙されるとしても毎日新聞の読者だけだ。\nいわいるそういう人達。', ' とにかく外国人への生活保護は誰も納得しないしありえない\n国民健康保険も全く同じ\n是正を強く望みます']"
3,この石破氏の発言は、一部野党と左派マスコミと同じで「お花畑」→【総裁選ドキュメント】公開討論会　対中外交　岸田氏「したたかにコントロール」　石破「米中協力する世の中を」　菅氏「ハイレベルの機会活用」 https://t.co/uHhGXoV4ki @Sankei_newsより,"[' @Sankei_news うんにゃ、ハニトラで手先になっただけ。理論思想なんてゼロ', ' @Sankei_news 米中協力って鳩山由紀夫みたい、中国の覇権主義はあり得ないという鳩山由紀夫と似た様な事を言っていたら、第二列島線まで攻めてくるかも。', ' @Sankei_news どっちつかずの政策を勧めた結果が今の韓国', ' @Sankei_news 総裁選でしたたかにコントローラとか言ってたら中国になめるなよとぶん殴られそうな予感', ' @Sankei_news 石破って評論家ですよね。', ' @Sankei_news 米国高官が「そのうち経済発展すれば自由社会に戻ってくるだろうとの期待は完全に裏切られた」と今の共産党支配の中国に絶縁状を叩きつけた情報が世界に流されているのに、「米中協力… https://t.co/aGmy1I6qBU', ' @Sankei_news 石破はダメ！\n\n日本を石破に任せたら、あの『悪夢の民主党』と同じ状況になるだろう', ' @Sankei_news 中国の言う、太平洋を二分するのに賛成するのか？危険な考え。', ' @SamuraiGifu2 @Sankei_news 超限戦を着実に実行している中国！米中仲良くなんて既にあり得ない！', ' @Sankei_news 石破さんも落ちたものだ。本流や本質から手っ取り早く違いをつくるとすると野党と同じになる。今の自民党なんて半端なところ多々あるのだから、本流を突き詰めることで違いをつくればいいのに。', ' @Sankei_news 反日議員は与党でも野党でも、選挙で落とすことが我々日本国民のミッションである🇯🇵 https://t.co/moPtENRhu8', ' 石破さんて中学2年生みたいに色んな事を勝手に脳内変換しちゃうんですよね。自分なら出来るって。1度だけインサイダーで儲けた株も脳内で自分は天才トレーダーってことになってるって某エコノミストの先生が言… https://t.co/ifeqWbfAha', ' @Sankei_news 菅さんは将来的には増税も有り得ると仰ってましたが、その辺はどうですか？', ' @Sankei_news 世界情勢といったことが、失礼だけど分かっていらっしゃらない😅橋本さんに鋭いこと聞かれてましたが、何故支持が集まらない?単にコミュ不足と言いたげな回答に、笑いが出た。やはり総理の器ではない!', ' @Sankei_news 日本の官僚すらうまく使えそうにないのに、したたかなコントロール出来るのだろうか。', ' @Sankei_news 彼だけファンタジーの世界で生きてますから', ' @Sankei_news 岸田さんがしたたか？どの口が言う？一番外交力が信用できない人どけどな。', ' @Sankei_news お三方ともデジタル化を強調されていますが、石破氏のような「米中協力する世の中」とは、昨今のIT覇権争いをどのように認識されているのか疑問です。\n石破氏が総理になることはな… https://t.co/9sxL2Wm1HZ', ' @Sankei_news ゲルの後ろにオザワがいる気がする', ' @Sankei_news 石破氏、所謂リベラルの話しぶり。具体策なき建前論が多い。防衛大臣の時は興味を持ったが、今は全く支持しない。', ' @l2rYTu2HVX1KvLA @Sankei_news ついに９．１１にまで言及しちゃって、もはや中共はあともどりも出来ずアメリカは黙々と海軍展開中。選挙前に大きな紛争は起こさないという常識は… https://t.co/tsjajLTnS3', ' @Sankei_news 一人落ちましたね。。あまりにも見えて無さすぎる。', ' @Sankei_news 「したたかにコントロール（日本がされる）」', 'い、憲法の上に共産党がある一党独裁国家。中国進出企業に対し2400億円の日本回帰補正予算が計上されたが、早く帰ってきたほうが日本企業のためでもある。そうしないと中国は人質とやりかねない', ' @Sankei_news 米中友好を日本が仲人、、、両サイドから金毟られる気しかしない。', ' もっと言えば「財政再建が先」と経済政策的に失格なことを言う石破茂には全く託そうとは思いません。', ' @Sankei_news 不当な人権侵害を続けている中国共産党とどうやって協力するというのでしょうか。\n石破は香港やウイグル・チベットの惨状が分かっていないとしか思えません。\n\nこんな基本的な世界情勢すら理解していない人に日本は任せられない。', ' @Sankei_news 石破氏は世界の動きがまるで見えていない。\n米ソ冷戦期に「双方協力する世の中を」と言っているようなもの。\nソ連を崩壊させたように米国は中共を潰しますよ。\n日本の立ち位置ははっきりしてるでしょう（怒💢）', ' @Sankei_news 香港や台湾やウイグルや内モンゴルで行われている弾圧を見て「中国と仲良く」ってお花畑も甚だしい。\n石破氏はすでに今生から解脱してあの世の光景が見えているのかも知れない…。', ' @Sankei_news ”日本がいかに中国に対処していくべきかについて”・・\n同じ保守政権与党内でこんなにビジョンに格差があってよいのでしょうか。\n特に石破氏については今総裁選としては厚顔無恥としか思えません。', ' @Sankei_news 旧ココム協定復活の流れが見えていないんじゃないだろうか？大丈夫かい・・・？', ' @Sankei_news 簡潔な解説ありがとうございます', ' @Sankei_news 石バランサーか？\n酒でも一緒に飲むのだろうか？笑', ' @Sankei_news 自民党の劣化も激しいね。\nマジ，親中派と増税派は自民党から，公明党は与党の立場からいなくなってくれよ。', ' @Sankei_news どなたも良くないかなと。ただ石破と岸田は現実を見ていないようで机上の空論にしか聞こえない。', ' @Sankei_news トランプのケツを舐めながら習近平にも尻尾を振ってきたのが安倍政権だから、それを犬ではなく人間として、国家の尊厳をかけて米中間に立つという点で石破の発言は間違ってない。', ' @Sankei_news 石破\u3000外交防衛は素人以下\n全部だめだけどｗ', ' @Sankei_news 石破氏の発言はお花畑でしょうかね。本音では無いでしょうか？もっと中国の僕として生きていくつもりじゃ無いでしょうか？\n其れを日本国民に背負わせる気つもりじゃないですか', ' @Sankei_news 石破は人気ありと勘違いして、マスコミに踊らされ、天狗になってないか。色んな所で石破の事聞いてみた。野党みたいな事言ってるな。自民党にいるより、辻元清美と手を組んだら韓国党で、出直しな。', ' @Sankei_news イシバシの目を覚まさせるためにビシバシとビンタを喰らわせる必要があるかもね。', ' @Sankei_news 立憲に担がれ党首として\n自民党に対峙したら盛り上がるのでは。', ' @Sankei_news 岸田さんの「したたか」って今までの業績みると、中韓の手玉にとられるだけじゃないかな。', ' @Sankei_news 戦争している二国間が協力するわけがない。\nただ、唯一例外が、WWII前の\nChinasyndrome\u3000→\u3000Yellow syndrome → Japan Synsgrom… https://t.co/Vpl4QNMg4h', ' @Sankei_news 石破さんが最下位になりますように⛩️⛩️⛩️⛩️', ' @Sankei_news この先、石バイデンになったらこの世は終わり', ' @Sankei_news ツチノコ新聞が石破氏を推す理由が分かる。', ' 米中協力などと言ってる人が日本の総理になったら確実にアメリカに見限られる', ' @Sankei_news ウシガエルに喰われるアマガエル。', ' @Sankei_news 人権弾圧国家と仲良くできるわけないだろう。アメリカは中国共産党が潰れるまで戦う。']"
